VerseID,TamilVerse,EnglishTranslation,Lagna,Khandam
Pisces-01,"உதையத்தில் பிதுர்க்காரகன் ஏகனாய் நட்புபெற்று சுக கேந்திரமேறிய பிதுர் ஸ்தானாதிபதியை  ஸ்வக்ஷேத்திர ஜென்ம கர்மாதிபதியால் பார்க்கப் பட்டிருந்தால் தந்தையுடன் ஆண் நான்கு, பெண்ணொன்று. தந்தை இருபத்தொன்பதில் மரணமாவனென்பர்.","When the Sun is alone in the Ascendant (Pisces), gaining strength by being in the friendly sign of Jupiter, and the 9th lord Mars is placed in a Kendra (4th house), receiving an aspect from Jupiter, who is both the Ascendant and 10th lord, and is in its sign, → then the father has four male siblings and one female sibling, → and the native’s father dies at the age of 29.",Pisces,Surya
Pisces-02,உதையத்தில் பிதுர்க்காரகன் சுக சப்தமாதிபதியுடன் கூடி ஒன்பதாமாதிபதியான குஜன் பனிரண்டாமிடமேறியிருந்தால் தந்தை ஏகன். ஜாதகனுக்கு ஐம்பதில் தந்தை மரணமாவனென்பர்.,"Pitrukaraka Sun is placed in Pisces Lagna and is conjoined with the Sukha and 7th house lord Mercury, and the 9th lord Mars is placed in the 12th house in Aquarius. Father will be a lone member. At the age of 50, the native father dies,",Pisces,Surya
Pisces-03,"உதையத்தில் பிதுர்க்காரகன் ஞானகாரகனுடன் கூடி சப்தம கேந்திரமேறிய பஞ்சமாதிபதியால் பார்க்கப்பட்டால் தந்தை வர்க்க மூன்றில் தந்தையே விர்த்தி, தந்தைக்குக் களத்திரமிரண்டென்பர்.","• Pitrukaraka conjoins Jnana karaka, Rahu (significator of wisdom/intellect) in Lagna. • The 5th lord aspects this conjunction from the 7th Kendra The result of this planetary configuration is that out of the three paternal lineages of the native, only the father progresses. Father will have two wives.",Pisces,Surya
Pisces-04,உதையத்தில் பிதுர்க்காரகன் திருதிய சுக சப்தம அஷ்டமாதிபதிகளுடன் கூடி ரோகமேறிய தன பாக்கியாதியால் பார்க்கப்பட்டால் ஜாதகன் பிறந்த இரண்டு மாதத்தில் தந்தை குடும்பம் விட்டு தேசாந்திரம் போவனென்பர்.,"In Pisces Lagna, the pitrukaraka Sun is conjoined with the third and eighth lord Venus, the fourth and the seventh lord Mercury, all occupying the ascendant. This conjunction is aspected by the second and ninth lord, Mars, placed in the sixth house. As a result of this configuration, the native’s father departs from the family and relocates to a distant place within two months of the native’s birth.",Pisces,Surya
Pisces-05,"உதையத்தில் பிதுர்க்காரகன் திருதிய அஷ்டமாதிபதியுடன் கூடி பிதுர் ஸ்தானத்தில் பஞ்சமாதிபதி நீச்சனாயிருந்தால், ஜாதகன் பிதுர், மாதுர் கர்மம், அன்னிய கர்மம் செய்வனென்பர்.","Sun (Pitrukaraka) is placed in Lagna (Pisces). Venus, lord of the 3rd and 8th houses, is conjoined with the Sun in the Ascendant. Moon, the 5th lord, is debilitated in Scorpio, occupying the 9th house (house of father and dharma). The native is destined to perform funeral/ritualistic karmas for the father, mother, and others (non-family individuals), indicating a deep karmic engagement with death-related duties.",Pisces,Surya
Pisces-06,"இரண்டாமிடத்தில் பிதுர்க்காரகன் ஏகனாய் உச்சம் பெற்று, உச்ச லாப விரையாதிபதியால் பார்க்கப் பட்டால் தந்தையுடன் ஆண் மூன்று, பெண்ணிரண்டு. தந்தைக்குத் தாரமிரண்டென்பர்.","Sun (Pitrukaraka) is alone in the 2nd house (Aries) and is exalted. Saturn, exalted and aspecting the Sun, is the lord of the 11th (labha – gains) and 12th (loss/separation) houses, placed in the 8th house (Libra). This planetary setup indicates: • Father is accompanied by three male siblings and two female siblings. • Father has two wives.",Pisces,Surya
Pisces-07,"இரண்டாமிடத்தில் பிதுர்க்காரகன்  சுக சப்தமாதிபதியுடன் கூடி, பிதுர் ஸ்தனத்தை ஆரல், ஆசான் சேர்ந்து பார்த்தால் தந்தை எட்டு வயதில் மரணமாவனென்பர்.","In the 2nd house, to Pisces Lagna, Sun is placed with the 4th and 7th lord Mercury, and the 9th house is aspected by Mars and Jupiter. The father will die at the age of eight for the native.",Pisces,Surya
Pisces-08,இரண்டாமிடத்தில் பிதுர்க்காரகன் சுக்கிரன் கேதுவுடன் கூடி பிதுர் ஸ்தானாதிபதியான குஜன் மூன்றாமிடமே றியிருந்தால் தந்தை வர்க்க மூவரிலொருவன் அன்னிய தேச மாரலாவனென்பர்.,"• Sun (Pitrukaraka) is placed in the 2nd house (Aries). • It is conjoined with: o Venus, ruler of the 3rd and 8th houses. o Ketu, the karmic moksha karaka. • Mars, the 9th lord (significator of father), is placed in the 3rd house (Taurus). • Result: Among three paternal males, one dies in a foreign country, indicating karmic displacement and distant culmination.",Pisces,Surya
Pisces-09,"இரண்டாமிடத்தில் பிதுர்க்காரகன் தன, சுக, சப்தம, பாக்கியாதிபதிகளுடன் கூடி, பிதுர் ஸ்தானத்தில் கேதுயிருந்தால் தந்தை ஜாதகனுக்கு பதினைந்தில் மரணம், பிதாவால் கட்டிய மனை கட்டட முண்டென்பர்.",Pitrukaraka Sun is in the 2nd house (Aries). It is conjoined with: • Mars – lord of 2nd (Dhana) and 9th (Bhagya/paternal) houses. • Mercury – lord of 4th (Sukha) and 7th houses. Ketu is placed in the 9th house (house of father and dharma). • The native’s father dies when the native is 15 years old. • A building or house constructed by the father exists (a karmic material legacy).,Pisces,Surya
Pisces-10,"இரண்டாமிடத்தில் பிதுர்க்காரகன் ஏகனாயிருந்து பாக்கியத்திலிருக்கும் பிதுர் ஸ்தானாதிபதியை உச்ச குருவால் பார்க்கப் பட்டிருந்தால் பிதா தனவான், தீர்க்காயுள் அனேக பூமிகளுடையவனென்பர்.","Sun, the Pitrukaraka, is alone in the 2nd house (Aries). • The 9th lord Mars (significator of father) is placed in the 9th house (Scorpio) – its own sign. • Jupiter, exalted in Cancer (5th house), aspects the 9th house (Pitrusthana). • This indicates that the native's father is wealthy, long-lived, and possesses extensive land holdings or real estate assets.",Pisces,Surya
Pisces-11,"மூன்றாமிடத்தில் பிதுர்க்காரகன், புந்தி, ராகுவுடன் கூடியிருந்தால் தந்தை சகோதரம் ஆணிரண்டு, பெண்ணொன்று, கனிட்ட பிதா விர்த்தியில்லை. ஜாதகன் பிறந்த நான்கு வயது வரையில் உத்தியோக நஷ்டம், இருபத்தெட்டில் பிதுர் கர்மமென்பர்.",The Pitrukaraka (Sun) is in the 3rd house (Taurus) from Pisces Lagna. The Sun is conjoined with Mercury (Budh) and Rahu. The native’s father has two brothers and one sister. The youngest paternal sibling remains unestablished (no career or sustenance). The father experiences job loss by the time the native is 4 years old. The father dies when the native is 28 years old.,Pisces,Surya
Pisces-12,"மூன்றாமிடத்தில் பிதுர்க்காரகன், ஏகனாய் நின்று, ஆறிலிருக்கும் லாப விரையாதிபதியால் பார்க்கப்பட்டு பிதுர் ஸ்தானத்தில் பஞ்சமாதிபன் நீச்சமடைந்தால் தந்தையுடன் ஆணிரண்டு, பெண்ணிரண்டு, நாற்பது நாளில் பிதுர் கர்மமென்பர்.","Pitrukaraka Sun is alone in the 3rd house (Taurus). Saturn, lord of the 11th (gains) and 12th (losses), is placed in the 6th house and aspects the Sun. Moon, lord of the 5th house, is debilitated in the 9th house (Scorpio). • The father has two male and two female children (native included). • The father dies 40 days after the birth of the native.",Pisces,Surya
Pisces-13,"மூன்றாமிடத்தில் பிதுர்க்காரகன், தன சுக, சப்தம, பாக்கியாதிபதிகளுடன் கூடியிருந்தால் தந்தை வர்க்க மூன்றிலொருவன் ஜல யாத்திரையில் மரணம். பிதா வேதாந்தி, தீர்த்த யாத்திரை யுடையவனென்பர்.","• Pitrukaraka Sun is placed in the 3rd house (Taurus). • It is conjoined with: o Mars – lord of 2nd (Dhana/Wealth) and 9th (Bhagya/Father) o Mercury – lord of 4th (Sukha/Mother) and 7th (Spouse) • This configuration signifies: o Among the three paternal male lineages (siblings), one dies during a water pilgrimage. o The father is spiritually inclined (Vedantin) and engages in pilgrimages to sacred waters (Theertha Yatra).",Pisces,Surya
Pisces-14,"மூன்றாமிடத்தில் பிதுர்க்காரகன், சுக சப்தமாதிபதியுடன் கூடி பிதுர் ஸ்தானாதிபதி நீச்சமடைந்திருந்தால், தந்தை வர்க்கம் ஆண் மூன்றில் தந்தை ஞானியாயும், சோதிட சாஸ்திரியாயும், யோகவானாயும், தீர்க்கவானாயுமிருப்பனென்பர்.","• Pitrukaraka Sun is in the 3rd house (Taurus). • Conjoined with Mercury, lord of the 4th (Sukha) and 7th (Kalatra) houses. • Mars, the 9th lord (house of father), is debilitated in the 5th house (Cancer). • Among three male members of the paternal lineage, the father is: o A scholar o An astrologer o A fortunate individual o A person of long life (Deerghayu)",Pisces,Surya
Pisces-15,"மூன்றாமிடத்தில் பிதுர்க்காரகன், சுக சப்தமாதிபதியுடன் கூடி பிதுர் ஸ்தானாதிபதியான குஜன் ஞானகாரகனுடன் சப்தம கேந்திரம் பெற்றிருந்தால் தந்தை ஏகன், வர்த்தக மூலம் உபாய ஜீவனம் செய்வனென்பர்.","• The Sun (Pitrukaraka) is placed in the 3rd house (Taurus). • It is conjoined with Mercury, lord of the 4th (Sukha) and 7th (Kalatra) houses. • The 9th lord Mars (significator of father and dharma) is in the 7th house, conjoined with Rahu, a Gyana karaka (significator of knowledge or unconventional intelligence). • The father is a solitary individual (no siblings or estranged). • He earns his livelihood through trade or business, employing unconventional or clever strategies.",Pisces,Surya
Pisces-16,"நான்காமிடத்தில் பிதுர்க்காரகன் ஏகனாயிருந்து பிதுர் ஸ்தானம் பற்றிய லாப விரையாதிபதியை ரோக ஸ்தானமேறிய தன பாக்கியாதிபதியால் நோக்கப் பட்டால் தந்தையுடன் பெண்ணேகம், தீர்க்கமென்பர்.","Sun (Pitrukaraka) is alone in the 4th house (Gemini). Saturn, lord of the 11th (gains) and 12th (loss/separation), is placed in the 9th house (house of father – Scorpio). Mars, lord of the 2nd (family) and 9th (father), is placed in the 6th house (Leo), from where it aspects Saturn. This configuration results in: • The father has one female companion (interpreted as one daughter or a female sibling in the household). • The father is long-lived (தீர்க்கம்).",Pisces,Surya
Pisces-17,"நான்காமிடத்தில் பிதுர்க்காரகன் திருதிய சுக சப்தம அஷ்டமாதிபதிகளுடன் கூடி களத்திர ஸ்தானமேறிய லாப விரையாதிபதியால் நோக்கப் பட்டிருந்தால் தந்தையுடன் ஆண் நான்கு, பெண்ணொன்று, ஜாதகன் வருட மூன்றில் மரணமென்பர்.","Sun (Pitrukaraka) is in the 4th house (Gemini) conjoined with: • Mercury (3rd and 7th lord – siblings & marriage), • Venus (8th and 3rd lord – longevity & siblings). Saturn, the 11th (gains) and 12th (loss) lord, is placed in the 7th house (Virgo), aspecting this trio in the 4th. • The father is accompanied by four males (sons or siblings) and one female. • The native dies in the 3rd year of life.",Pisces,Surya
Pisces-18,"நான்காமிடத்தில் பிதுர்க்காரகன் சுக சப்தமாதிபதியுடன் கூடி, பிதுர் ஸ்தானத்தில் நீச்சனிருந்தால் ஜாதகன் பிறந்த பின்பு பிதுர், மாதுர் விரோதமுண்டாகி அம்மான் வீட்டில் வளர்வனென்பர்.","Pitrukaraka Sun is in the 4th house (Gemini), conjoined with Mercury, the lord of the 4th (Sukha) and 7th (Kalatra). Moon, representing the 5th house (intelligence) and also motherly nurturing, is debilitated in Scorpio, the 9th house (father). Following the native’s birth, a conflict develops between the parents, resulting in the native being raised by the maternal uncle.",Pisces,Surya
Pisces-19,"நான்காமிடத்தில் பிதுர்க்காரகன் புதன், சுக்கிரனுடன் கூடி பிதுர்ஸ்தான மேறிய பஞ்சம, லாப, விரையாதிபதிகளால் நோக்கப் பட்டிருந்தால், தந்தையுடன் பெண்ணிரண்டு, விர்த்தியில்லை. முப்பதுக்குமேல் பிதுர் கண்டம், ரோகாதிபன் திசையில் ஜாதகன் பரதேசியாவனென்பர்.","Sun (Pitrukaraka) is conjoined with Mercury (4th & 7th lord) and Venus (3rd & 8th lord) in the 4th house (Gemini). The 9th house (Scorpio) is occupied by Saturn and Moon, who are the lords of the 11th & and 12th 5th respectively. Effects: • Father is accompanied by two female siblings, all without professional progress. • After age 30, the father enters a difficult phase (கண்டம்). • In the dasa of the 6th lord, the native moves abroad.",Pisces,Surya
Pisces-20,"நான்காமிடத்தில் பிதுர்க்காரகனுடன் சந்திரன், புதன், சுக்கிரனிவர் மூவர் கூடி, பிதுர் ஸ்தானத்தை சத்துரு ஸ்தானமேறிய தன பாகியாதியால் நோக்கப்பட்டால், தந்தையுடன் ஆண் மூன்று, பெண்ணொன்று. இருபத்திரண்டில் பிதுர் கர்மம், பிதுர்கள் தேசமாறி ஜீவிப்பரென்பர்.","• Sun (Pitrukaraka) is placed in the 4th house (Gemini) along with: o Moon (5th lord), o Mercury (4th and 7th lord), o Venus (3rd and 8th lord). • The 9th house (Scorpio), home of the father, is aspected by Mars (2nd and 9th lord), who is placed in the 6th house (Leo), a dusthana (malefic house). • There will be three male and one female sibling for the father. At the age of 22 of the native father will die. Siblings will be living in various countries.",Pisces,Surya
Pisces-21,"ஐந்தாமிடத்தில் பிதுர்க்காரகன் சுக சப்தமாதிபதியுடன் கூடி ஜென்ம கர்மாதிபதியான குரு ராகுவுடன் பிதுர் ஸ்தானமேறியிருந்தால் தந்தை வர்க்கம் ஆணிரண்டு, ஜெனன காலம் கஷ்டம், பிதா மறைபடுவனென்பர்.","Sun (Pitrukaraka) is placed in the 5th house (Leo) along with Mercury (lord of 4th and 7th). Jupiter (Ascendant and 10th lord) and Rahu are placed in the 9th house (Scorpio). Two male siblings. The native experiences hardship at birth, and the father is said to vanish or disappear mysteriously (marai paduthal).",Pisces,Surya
Pisces-22,"ஐந்தாமிடத்தில் பிதுர்க்காரகன் திருதிய பஞ்சம அஷ்டமாதிபதிகளுடன் கூடி பாக்கியமேறிய இரவி புதல்வனை, தன பாக்கியாதிபதியால் நேரே பார்க்கப் பட்டிருந்தால் தந்தைக்குத் தாரமிரண்டு, இளமையில் மரணமென்பர்.","The Pitrukaraka Sun is conjoined in the 5th house (Cancer) with Moon (5th lord) and Venus (3rd and 8th lord). Mars (9th and 2nd lord) is placed in the 3rd house (Taurus), and Saturn is placed in the 9th house directly. This configuration results in the father having two wives and an early death.",Pisces,Surya
Pisces-23,ஐந்தாமிடத்தில் பிதுர்க்காரகன் நீச்சனுடன் கூடியிருந்தால் தந்தை வர்க்கம் நிலைப்பு ஆணிரண்டு. வர்க்கம் செல்வமுண்டாம். தந்தைக்கு சிரசில் ரோகம். புத்திர தோஷமுண்டென்பர்.,"Pitrukaraka Sun is placed in the 5th house to the Pisces Lagna native and is conjoined with the debilitated Mars. In the father’s lineage, there will be two male members. Lineage will be wealthy. Father will have a disease in the head. There is Putra Dosha.",Pisces,Surya
Pisces-24,"ஐந்தாமிடத்தில் பிதுர்க்காரகன் ஞானகாரகனுடன் கூடி பிதுர் ஸ்தானாதிபதியான குஜன் சப்தம கேந்திரத்தில் உபைய மந்திரிகளுடன் கூடியிருந்தால் தந்தை ஏகம், பூமி, செல்வம், பலமான கட்டட முண்டாம். ஜாதகனுக்குப் பதினொன்றில் பிதுர் கர்மமென்பர்.","In the fifth house to Pisces Lagna, pitrukaraka Sun is conjoined with Gnana Karaka Rahu, and the 9th lord Mars is placed in the 7th house with the two ministers, Mercury and Venus. Father will be alone; there will be lands, wealth and strong buildings. The native has to perform the final rites for the father at 11th age.",Pisces,Surya
Pisces-25,"ஐந்தாமிடத்தில் பிதுர்க்காரகன் ஏகனாயிருந்து லாபாதிபதியால் பார்க்கப் பட்டு பாக்கியத்தில் பிதுர் ஸ்தானாதிபன் நீச்சனுடன் கூடி, மூன்றிலிருக்கும் ஜென்ம கர்மாதிபதியால் நோக்கப் பட்டிருந்தால் தந்தை வர்க்கமிருவன். பிதா கைத்தொழில் மூலம் உபாய ஜீவனம் செய்வனென்பர்.","Sun (Pitrukaraka) is placed alone in the 5th house (Cancer). Saturn (11th lord of gains) aspects the Sun from Capricorn. In the 9th house (Scorpio), Mars (9th lord, debilitated) and Moon (5th lord) are placed. Jupiter (10th lord) is placed in Taurus (3rd house) and aspects the 9th house. The native’s paternal lineage has two male members. The father earns a living through manual work or a craft-based profession.",Pisces,Surya
Pisces-26,"ஆறாமிடத்தில் பிதுர்க்காரகன் ஏகனாய், ஸ்வக்ஷேத்திரம் பெற்று பிதுர் ஸ்தானத்தை பஞ்சம திரிகோணமேறிய உச்சனால் பார்க்கப் பட்டால், பிதாவுடன் பெண்ணொன்று. பிதா முப்பத்து நான்கில் அரிட்டமாவனென்பர்.","The Pitrukaraka Sun is placed alone in the 6th house (Leo), its sign (Swa-Kshetra). The 9th house (house of father) receives the aspect of exalted Jupiter, placed in the 5th house (Cancer), a trinal (trikona) house. • Result: o The native will have one female sibling along with the father. o The father will die when the native reaches the age of 34.",Pisces,Surya
Pisces-27,"ஆறாமிடத்தில் பிதுர்க்காரகன் சுக சப்தமாதிபதியுடன் கூடி பிதுர் ஸ்தானத்தை திருதியமேறிய லாப விரையாதிபதியால் நோக்கப் பட்டால் தந்தையுடன் ஆணாறு, கைத்தொழில் விர்த்தி. இருபத்திரண்டு வரையில் பிதுர், மாதுரு தீர்க்கமென்பர்.","The Pitrukaraka Sun is placed in the 6th house (Leo) along with Mercury, the 4th and 7th lord (significators of comfort and spouse). This conjunction is aspected by Saturn, who is the 11th and 12th lord, placed in the 3rd house (Taurus). • Result: o The native’s father is accompanied by six male members (suggesting siblings). o The family is involved in hand-based skills or craftsmanship (கைத்தொழில்) o Both father and mother live until the native turns 22.",Pisces,Surya
