VerseID,TamilVerse,EnglishTranslation,Lagna,Khandam
Pisces-28,"ஆறாமிடத்தில் பிதுர்க்காரகன் புதன் கேதுவுடன் கூடி பிதுர் ஸ்தானத்தில் லாப விரையாதிபனேறியிருந்தால் பிதா வர்க்கம் ஆண் மூன்று. முப்பத்து மூன்றில் பிதுர் கண்டம், அடுத்து மாதுரு கர்மம், அப்பால் கஷ்ட பலனென்பர்.","The Pitrukaraka Sun is conjoined with Mercury and Ketu in the 6th house (Leo). The 9th house (Scorpio), representing the father, is occupied by Saturn, who is the 11th and 12th lord. • The father belongs to a paternal lineage of three males. • The father enters a critical health phase at the native’s age of 33. • This is followed by the death of the mother and a period of hardship for the native.",Pisces,Surya
Pisces-29,"ஆறாமிடத்தில் பிதுர்க்காரகன் ஏகனாய் தனித்து ஒன்பதாமாதி சுக்கிரனுடன் பஞ்சம திரிகோணமேறி நீச்ச குருவால் பார்க்கப் பட்டிருந்தால் பிதா ஏகன், மேலான யோகமடைவனென்பர்.","The Pitrukaraka Sun is placed alone in the 6th house (Leo). The 9th lord Mars is conjoined with Venus (lord of the 3rd and 8th houses) in the 5th house (Cancer), which is a Trikona (trinal) house. This combination is aspected by a debilitated Jupiter from Capricorn. The native’s father is said to be a lone figure (no siblings or close paternal associates) and will attain higher yogas—indicative of spiritual merit, success, or karmic reward.",Pisces,Surya
Pisces-30,"ஆறாமிடத்தில் பிதுர்க்காரகன் சுக பஞ்சம சப்தமாதிபதியுடன் கூடி பிதுர் ஸ்தானத்தில் லாப விரையாதிபதியுடன் கேது கூடியிருந்தால் தந்தை வர்க்கமிருவர் தீர்க்கம். வியாபாரம், பூமி மூலம் ஜீவனம். இருபத்தாறு வரையில் பிதா தீர்க்கமென்பர்.",The Pitrukaraka Sun is conjoined with Mercury (4th & 7th lord) and Moon (5th lord) in the 6th house (Leo). The 9th house (Scorpio) is occupied by Saturn (lord of 11th and 12th) and Ketu. This configuration indicates: • Two long-lived male members in the paternal lineage. • The father earns through land-related activity and trade. • The father is alive until the native turns 26. ஏழாமிடம்,Pisces,Surya
Pisces-31,ஏழாமிடத்தில் பிதுர்க்காரகன் நீச்சனுடன் கூடி பிதுர் ஸ்தானத்தில் பஞ்சமாதிபதியான சந்திரன் நீச்சமடைந்திருந்தால் ஜாதகன் ஜெனித்த மூன்று திங்கள் முதல் தந்தைக்கு உத்தியோக மேன்மையுண்டென்பர்.,"The Pitrukaraka Sun is placed in the 7th house (Virgo) along with Venus, who is debilitated in this sign. In the 9th house (Scorpio), the Moon, which is the 5th lord, is also debilitated. This planetary configuration indicates that within three months of the native's birth, the father will receive a promotion or elevation in his professional life.",Pisces,Surya
Pisces-32,"ஏழாமிடத்தில் பிதுர்க்காரகன் சுக்கிரன், ராகு இவர்களுடன் கூடி பிதுர் ஸ்தானத்தில் நீச்சனிருந்தால் தந்தை வர்க்கமூன்று, பதினெட்டில் பிரிவுபடும், இருபத்தைந்தில் பிதுர் மரணமென்பர்.","The Pitrukaraka Sun is placed in the 7th house (Virgo) along with Venus and Rahu. In the 9th house (Scorpio), the Moon—the 5th lord—is placed in debilitation. This configuration reveals: • There are three members in the paternal lineage. • At the age of 18, the family will disintegrate. • The father dies in the native’s 25th year.",Pisces,Surya
Pisces-33,ஏழாமிடத்தில் பிதுர்க்காரகன் ஏகனாய் நின்று லக்கின கேந்திரம் பெற்ற ஜென்ம கர்ம லாப விரையாதிபதிகளால் பார்க்கப்பட்டிருந்தால் தந்தை வர்க்க மூன்றிலொருவன் மத்தியில் மரணம். தந்தை சில நாள் சுகமும் பின்னால் துன்பமும் படுவனென்பர்.,"In Pisces Lagna, the Pitrukaraka Sun is placed alone in the 7th house (Virgo). It receives aspects from: • Jupiter, lord of Lagna and 10th house (Kendra influence), • Saturn, lord of the 11th and 12th houses.-both placed in Lagna The verse states: • Among three paternal siblings, one dies in the middle age. • The father will enjoy comforts for a period but will later experience troubles and suffering.",Pisces,Surya
Pisces-34,"ஏழாமிடத்தில் பிதுர்க்காரகன் சந்திரன், சுக்கிரன், கேது இவர்களுடன் கூடியிருந்தால் தந்தை வர்க்கம் ஆண் ஐந்து, பெண் எட்டில் தீர்க்கம் ஆணிரண்டு, பெண்ணான்கு. எட்டு வயதில் பிதாவுக்குக் கர்மமென்பர்.","To Pisces Lagna, the Sun (Pitrukaraka) is placed in the 7th house (Virgo) along with Moon (5th lord), Venus (3rd and 8th lord), and Ketu. • In the father’s lineage, there are five male and eight female siblings, out of which two males and four females are long-lived. • The native performs the final rites for the father at the age of 8.",Pisces,Surya
Pisces-35,ஏழாமிடத்தில் பிதுர்க்காரகன் சுக சப்தமாதிபதியுடன் கூடி பிதுர் ஸ்தானத்தை உச்ச சந்திரனால் பார்க்கப் பட்டால் முப்பது வரையில் தந்தைக்கு திர்க்கமென்பர்.,"The Pitrukaraka Sun is placed in the 7th house (Virgo) to Pisces Lagna, along with Mercury, the lord of the 4th (Sukha) and 7th (Kalatra) houses. The 9th house (house of father and fortune) is aspected by the exalted Moon from Taurus. This configuration suggests that the native's father will live up to the age of 30.",Pisces,Surya
Pisces-36,"எட்டாமிடத்தில் பிதுர்க்காரகன் நீச்சனாய் சனியுடன் கூடி நீச்ச செவ்வாயால் பார்க்கப்பட்டு பிதுர் ஸ்தானத்தில் சுக பஞ்சம சப்தமாதிபர்களேறியிருந்தால் பிதா இருவர், அன்னிய தேச மரணமென்பர்.","In the 8th house (Pisces), the Pitrukaraka Sun is in debilitation and is conjoined with Saturn. This combination is aspected by debilitated Mars from the Cancer. In the 9th house (Scorpio), Mercury (4th and 7th lord) and Moon (5th lord) are placed. This planetary configuration suggests that: • There are two paternal figures (likely father and one male sibling). • The father dies in a foreign land, signifying karmic dislocation and separation.",Pisces,Surya
Pisces-37,"எட்டாமிடத்தில் பிதுர்க்காரகன் புதன் கரும்பாம்பு இவர்களுடன் கூடி குடும்பமேறிய ஜென்ம கர்மாதிபதியால் நோக்கப் பட்டால் தந்தை வர்க்கம் எட்டு, நிலைப்பு மூன்று. இருபதில் பிதுர் கர்மமென்பர்.","In Pisces Lagna, the Pitrukaraka Sun is placed in the 8th house (Libra) along with Mercury and Rahu. The combination is aspected by Jupiter, which is placed in the 2nd house (Aries). The native’s paternal lineage consists of eight male members, but only three survive long-term. The native performs the final rites for his father at the age of 20.",Pisces,Surya
Pisces-38,"எட்டாமிடத்தில் பிதுர்க்காரகன் ஏகனாய் நின்று சுக சப்தமாதிபதியான புதன் கேதுவுடன் பிதுர் ஸ்தானமேறி லாப விரையாதிபதியால் நேரே பார்க்கப் பட்டிருந்தால் தந்தைக்குத் தாரமிரண்டு, தந்தை இருபத்திரண்டில் மரணமென்பர்.","• Lagna: Pisces (Meena) • Sun (Pitrukaraka) is placed alone in the 8th house (Libra), in debilitation. • Mercury (lord of 4th and 7th houses – sukha and kalatra) and Ketu are placed in the 9th house (Scorpio). • Saturn, the 11th and 12th lord, aspects the 9th house. • Result: Father has two wives. Father dies at the native’s age of 22.",Pisces,Surya
Pisces-39,"எட்டாமிடத்தில் பிதுர்க்காரகன் செவ்வாய், ராகு இவர்களுடன் கூடி கிரக ஸ்தானமேறிய ஜென்ம கர்மாதிபதியால் நோக்கப் பட்டிருந்தால் தந்தை ஏகன், கிருஷி மூலம் ஜீவிப்பனென்பர்.","Lagna: Pisces (Meena) Sun (Pitrukaraka) is placed in the 8th house (Libra). Mars (9th and 2nd lord – Father & Wealth), and Rahu are also placed in the 8th house. Jupiter (Lagna and 10th lord) is placed in the 4th house (Gemini) and aspects the 8th house. Father is a lone person, and his livelihood is through agriculture (Krishi).",Pisces,Surya
Pisces-40,"எட்டாமிடத்தில் பிதுர்க்காரகன் சுக சப்தமாதியுடன் கூடி விரைய ஸ்தானமேறிய ஜென்ம கர்மாதிபதியால் நோக்கப் பட்டிருந்தால் தந்தை ஏகம். தேச சஞ்சாரி, பிதுர் வர்க்கம் விர்த்தியில்லை யென்பர்.","• Lagna: Pisces (Meena) • Sun (Pitrukaraka) is placed in the 8th house (Libra). • Conjoined with Mercury, lord of 4th (Sukha) and 7th (Kalatra). • Jupiter, the Lagna and 10th lord (Karma Adhipati), is placed in Aquarius, the 12th house (Vyaya Sthana), and aspects the Sun and Mercury in the 8th. • Result: o Father is alone (no paternal siblings with progress), o Engages in travel or wandering, o Father's lineage lacks vocational advancement or worldly success.",Pisces,Surya
Pisces-41,"ஒன்பதாமிடத்தில் பிதுர்க்காரகன் சுக சப்தமாதிபதியுடன் கூடி புத்திர ஸ்தானத்தை சனி பத்தாம் பார்வை பார்க்கப் பட்டிருந்தால் தந்தை வர்க்கம் ஆண் நான்கு, பிதா அரசாங்கத்தை யடுத்தவனாய் காய சித்தியை விரும்புவனென்பர்.","Lagna: Pisces Sun (Pitrukaraka) is in the 9th house (Scorpio), Mercury (4th and 7th lord – Sukha and Kalathra) is conjoined with the Sun, Saturn, likely placed in the 8th house, aspects the 5th house (Putra Sthana) with its 10th aspect • Father’s lineage has four male siblings • Father is aligned with the government • Inclined towards Kaya siddhi (spiritual and physical perfection practices)",Pisces,Surya
Pisces-42,ஒன்பதாமிடத்தில் பிதுர்க்காரகன் சுக சப்தமாதிபதியுடன் கூடி ரோக ஸ்தானமேறிய தன பாக்கியாதிபதியால் பார்க்கப் பட்டிருந்தால் பதினொன்றில் பிதுர் மரணம். ஜாதகனுக்கு ஆறாதிபன் திசையில் விசேஷ யோக பலனுண்டென்பர்.,"• Lagna: Pisces • Pitrukaraka Sun is in the 9th house (Scorpio) • Conjoined with Mercury, lord of the 4th (Sukha) and 7th (Kalathra) houses • Mars, the 2nd and 9th lord, is in the 6th house, aspecting the Sun and Mercury • Result: o The father dies when the native is 11 years old o The native enjoys special yogas or favourable effects during the dasa of the 6th lord (Sun)",Pisces,Surya
Pisces-43,ஒன்பதாமிடத்தில் பிதுர்க்காரகன் திருதிய அஷ்டமாதிபதியுடன் கூடி பாக்கியாதிபதி இரண்டிலிருந்து நோக்கினால் பானு திசையில் பிறந்தால் ஜாதகன் மூன்றாம் நாளரிட்டமாவனென்பர்.,"The Pitrukaraka Sun is placed in the 9th house (Scorpio) in Pisces Lagna, conjoined with Venus, the lord of the 3rd and 8th houses. This conjunction is aspected by Mars, the 9th and 2nd lord, placed in the 2nd house (Aries). If the native is born during the Sun’s Mahadasha, he will die on the third day of birth.",Pisces,Surya
Pisces-44,ஒன்பதாமிடத்தில் பிதுர்க்காரகன் திருதிய சுக சப்தம அஷ்டமாதிபதிகளுடன் கூடி உச்ச பஞ்சமாதிபதியால் நோக்கப் பட்டிருந்தால் தந்தை பூமி மூலம் ஜீவனம் செய்வனென்பர்.,"For a native with Pisces Lagna, the Sun (Pitrukaraka) is placed in the 9th house (Scorpio) along with Mercury (lord of 4th and 7th) and Venus (lord of 3rd and 8th). This conjunction is aspected by the exalted Moon (5th lord) from Taurus. The father will likely earn his livelihood through land-related means, such as agriculture or real estate.",Pisces,Surya
Pisces-45,"ஒன்பதாமிடத்தில் பிதுர்க்காரகன் திருதிய அஷ்டமாதிபதியுடன் கூடி உச்ச சந்திரனால் பார்க்கப் பட்டிருந்தால் தந்தை ஏகன். அம்மான் வீட்டை யடுத்திருப்பன், அல்ப்ப ஜீவனமென்பர்.","In Pisces Lagna, the Pitrukaraka Sun is placed in the 9th house along with Venus, who is the 3rd and 8th lord. This conjunction is aspected by the exalted Moon. The father will be a lone person, residing near his maternal relatives (his maternal uncle’s house), and will have a life of modest means.",Pisces,Surya
Pisces-46,"பத்தாமிடத்தில் பிதுர்க்காரகன் சுக சப்தமாதிபதியுடன் கூடி உச்ச சனி திருஷ்டி பெற்று பாக்கியத்திலிருக்கும் பிதுர் ஸ்தானாதிபதியை உச்ச குருவால் நோக்கப் பட்டால் தந்தை வர்க்கம் ஆண் மூன்று, பெண்ணிரண்டென்பர்.","In Pisces Lagna, the Pitrukaraka Sun is placed in the 10th house (Sagittarius) along with Mercury, the lord of the 4th and 7th houses. This combination is aspected by exalted Saturn from Libra (8th house). Mars, the 9th lord placed in the 9th house (Scorpio), is aspected by exalted Jupiter from Cancer (5th house). In the father's lineage, there will be three male and two female members.",Pisces,Surya
Pisces-47,"பத்தாமிடத்தில் பிதுர்க்காரகன் புதன், சுக்கிரனுடன் கூடி பாக்கியத்தில் பிதுர் ஸ்தானாதிபன் பஞ்சமாதியுடன் சேர்ந்திருந்தால் தந்தை வர்க்கம் ஆணிரண்டு, தந்தைக்குத் தாரமிரண்டென்பர்.","In Pisces Lagna, the Sun (Pitrukaraka) is placed in the 10th house (Sagittarius) with Mercury (4th and 7th lord) and Venus (3rd and 8th lord). In the 9th house (Scorpio), Mars (9th lord and 2nd lord) is conjoined with Moon (5th lord). This configuration results in two male siblings in the father's lineage, and the father will have two wives.",Pisces,Surya
Pisces-48,"பத்தாமிடத்தில் பிதுர்க்காரகன் கரும்பாம்புடன் கூடி பிதுர் ஸ்தானத்தில் சுக சப்தமாதிபனேறியிருந்தால் தந்தை வர்க்கம் நான்கு பேரும் பெருத்த அதிகாரம், செல்வ முடையவர்களா யிருப்பனன்பர்.","In the 10th house from Pisces Lagna, the Pitrukaraka Sun is conjoined with Rahu (Karum Bambu). The 9th house (Scorpio) is occupied by Mercury, the lord of the 4th (Gemini) and 7th (Virgo) houses. The father’s lineage includes four prominent individuals, all of whom possess wealth and high authority.",Pisces,Surya
Pisces-49,"பத்தாமிடத்தில் பிதுர்க்காரகன் ஏகனாய் நின்று சுக கேந்திரமேறிய ஸ்வக்ஷேத்திர மதி மகனால் பார்க்கப் பட்டிருந்தால், தந்தை வர்க்கம் செல்வமுள்ளவர்கள், தந்தைக்குத் தீர்க்காயுளுண்டென்பர்.","For a Pisces Lagna, the Sun (Pitrukaraka) is placed alone in the 10th house (Sagittarius). It is said to be aspected by Mercury, the lord of the 4th (comfort/home) and 7th (kalatra) houses, from its own house (Virgo/Gemini). This configuration is stated to indicate that the father’s lineage is wealthy, and the father will enjoy a long life (Deerghayushya).",Pisces,Surya
Pisces-50,"பத்தாமிடத்தில் பிதுர்க்காரகன் ஜென்ம கர்மாதிபதியுடன் கூடியிருந்தால் தந்தை கனத்த அதிகார முள்ளவனாயும், சுக வந்தனா யிருப்பனென்பர்.","If the Pitrukaraka Sun is placed in the 10th house (Sagittarius) along with Jupiter, who is both the Lagna lord and 10th lord (Janma and Karma Adhipathi), the native’s father will be a person of great authority and will enjoy a comfortable life.",Pisces,Surya
Pisces-51,"பதினோராமிடத்தில் பிதுர்க்காரகன் தன சுக சப்தம பாக்கியாதிபதிகளுடன் கூடி நீச்ச சனியால் பார்க்கப் பட்டிருந்தால் தந்தை வர்க்கம் ஆண் மூன்று, பெண் மூன்று. பதினான்கில் தந்தை மரண மடைவனென்பர்.","In Pisces Lagna, the Pitrukaraka Sun is placed in the 11th house (Capricorn) along with Mars (9th and 2nd lord), Mercury (4th and 7th lord), forming a conjunction. This trio is aspected by debilitated Saturn (from Aries). There will be three male and three female members in the father’s lineage. The native’s father will die in the 14th year of the native's life.",Pisces,Surya
Pisces-52,"பதினோராமிடத்தில் பிதுர்க்காரகன் புதன், கேது இவர்களுடன் கூடியிருந்தால் தந்தைக்குத் தாரமிரண்டு, பூமி மூலம் ஜீவனம், தந்தை தீர்க்காயு ளுடையவனா யிருப்பனென்பர்.","In the 11th house to Pisces Lagna, Sun is placed with Mercury and Ketu. This planetary configuration indicates that the father will have two wives, agriculture (land) will be the source of livelihood, and the father will be long-lived.",Pisces,Surya
Pisces-53,"பதினோராமிடத்தில் பிதுர்க்காரகன் லாப விரையாதிபதியுடன் கூடி பாக்கியத்தில் பிதுர் ஸ்தானாதிபதியுடன் ராகு சம்மந்த முண்டானால் தந்தை வர்க்கம் ஆணிரண்டு, தந்தை பதினெட்டில் மரணமாவனென்பர்.","In the 11th house to Pisces Lagna, the Sun (Pitrukaraka) is conjoined with Saturn, who is the lord of the 11th and 12th houses. In the 9th house (house of father), Mars (lord of the 2nd and 9th) is placed along with Rahu. This combination results in two male members in the father’s lineage. The native’s father will die at the age of 18.",Pisces,Surya
Pisces-54,"பதினோராமிடத்தில் பிதுர்க்காரகனுடன், சுக்கிரன், குரு, ராகு இவர் மூவர் கூடி பாக்கியத்தில் பிதுர் ஸ்தானாதிபன் ஸ்வக்ஷேத்திரம் பெற்றிருந்தால் தந்தை வர்க்கம் ஆண் மூன்று, ஒன்பது வயதில் தந்தைக்கு அரிட்டமுண்டென்பர்.","In the 11th house to Pisces Lagna, the Pitrukaraka Sun is placed along with Venus, Jupiter, and Rahu. The 9th lord Mars is placed in the 9th house in its own sign (Scorpio). This indicates that the father’s lineage has three male members, and the native’s father will die when the native is 9 years old.",Pisces,Surya
Pisces-55,"பதினோராமிடத்தில் பிதுர்க்காரகன் ஏகனாய் நின்று பஞ்சம திரிகோணமேறிய உச்ச குருவால் பார்க்கப் பட்டிருந்தால் தந்தை பலவான், அதிகாரமும் செல்வமு முடையவனா யிருப்பனென்பர்.","In the 11th house to Pisces Lagna, Pitrukaraka Sun is placed alone, and is aspected by exalted Jupiter from Cancer (5th house). The father will be a strong man, with authority and wealth.",Pisces,Surya
Pisces-56,"பனிரண்டாமிடத்தில் பிதுர்க்காரகன் ஏகனாய் நின்று பிதுர் ஸ்தானாதிபதியான குஜன் மூன்றாமிட மேறியிருந்தால் தந்தை வர்க்கம் ஆணிரண்டு, தந்தை அதிகார முள்ளவனா யிருப்பனென்பர்.","In the 12th house to Pisces Lagna, Sun is placed alone, and the 9th lord Mars is placed in the 3rd house. Father’s lineage will have two males. Father will be in authority.",Pisces,Surya
