VerseID,TamilVerse,EnglishTranslation,Lagna,Khandam
Leo-01,"உதயத்தில் மாதுர்காரகனும் ஐந்தாமிடத்தில் குருவும் 7-ல் சனியும் நின்றால் தாய்க்கும் சேய்க்கும்  3-15- இந்த வயதுகளில் கண்டம். தாயுடன் சகோதரம் ஆண்-2, பெண்-1. அம்மான் நிலை ஏகம். மாதா விதந்தாவள். பிறந்த வீடு கிலமாய்ப் போகும். பேய் வாசமாகும்.","The Moon is in Simha Lagna, Jupiter is in the 5th house, and Saturn is in the 7th house (thereby aspecting the Moon). Both mother and child will experience a crisis at the ages of 3 and 15. Mother will have two male and one female sibling. Uncle will be united. Mother will become a widow. The birth house will be destroyed. Spirits will reside in the house.",Leo,Chandra
Leo-02,"உதயத்தில் சந்திரனும் சிகியும் நின்று ஆயுள் ஸ்தானத்தில் சனியும் நின்றால் மாதாவின் சகோதிரம் -3, பெண்-2, ஆண்-1. தீர்க்கம்-2, ஆண்-1, பெண்-1. ஜனித்தவிடம் பாழ். வயது 2-ல் மாந்தம் வயிற்றுப் போக்கால் சேய் சுகரிட்டம். கேது திசை சந்திர புத்தியிலும், சுக்கிர திசை சந்திர புத்தியிலும் தாய்க்கு கண்டம்.","Moon is placed in Simha Lagna along with Ketu, and Saturn is placed in the 8th house of life. The mother will have one brother and two sisters. One sister and one brother will be long-lived. The birthplace will decay. At the age of 2, the child will be afflicted by indigestion and diarrhoea. Ketu dasa, Moon Bhukti, Venus dasa, Moon Bhukti, the mother will experience a crisis.",Leo,Chandra
Leo-11,ஒன்பதாமிடத்தில் ஆறாமாதிபதியும் மூன்றாமிடம் விரயாதிபதியும் கேதுவும் நின்றபடியால் சனிதிசை சந்திர புத்தியில் தாய் மாரகம். கேது புத்தியிலும் கண்டம் சம்பவிக்கும்.  சனி திசை அற்பமான பலன்.,"The Moon is placed in the 3rd house, along with Ketu, and is aspected by Saturn, the 6th lord, from the 9th house. The mother will die in Saturn dasa, Moon Bhukti. In Ketu Bhukti, there will be a crisis. Saturn dasa will give very meagre results.",Leo,Chandra
Leo-12,"ஒன்பதாமிடம் கர்மாதிபதியும் சுகாதிபதியும் நின்று சந்திரன் மூன்றாமிடமேறி ஒருவர்க்கொருவர் பார்க்கப் பட்டிருப்பதால் ஆண்-2, பெண்-2, தாய் தீர்க்கம். அம்மான் வேறிடம் சென்று ஜீவிப்பன்.","In the 9th house to Simha Lagna, the 10th lord of Karma, Venus, and the 4th lord of comfort, Mars, are placed, and the Moon is in the 3rd house, aspecting it mutually. The mother will have two male and two female siblings. Mother will be long-lived. Uncle will go to another place for his living.",Leo,Chandra
Leo-13,"ஒன்பதாமிடம் குருவும் மூன்றாமிடம் சூரியன் சந்திரன் அங்காரகனும் இருப்பதால் தாயுடன் ஆண்-1, பெண்-2. வயது 22-ல் தாய் மாரகம்.","Moon is placed in the 3rd house along with Mars and Sun, and is aspected by Jupiter from the 9th house. One male and two females will be the co-born of the mother. The mother will die at the age of 22 of the native.",Leo,Chandra
Leo-14,பாக்கியாதி கர்மத்திலும் அஷ்டமாதிபதி குரு நாலிலும் விக்ரம ஸ்தானத்தில் சந்திரனும் இருப்பதால் தாய் வர்க்கம் விருத்தி. மற்றது நாசமடையும்.,"The 9th lord Mars is in the 10th house, the Moon is placed in the 3rd house, and the 8th lord Jupiter is in the 4th house. The mother's clan will progress. Rest will perish.",Leo,Chandra
Leo-15,மாதுர்காரகன் த்ரீதியஸ்தானமேறி பஞ்சம அஷ்டமாதிபதி பாக்கியத்தில் நின்று பரஸ்பரம் வீக்ஷண்யமானபடியால் அம்மான் ஏகன். குருதிசை சந்திர புக்தியில் தாய் கண்டம்.,"Moon is placed in the 3rd house and is aspected by 5th and 8th lord Jupiter from the 9th house, one maternal uncle. In Jupiter dasa, Moon Bhukti, the mother will have a critical time.",Leo,Chandra
Leo-16,நான்காமிடத்தில் மாதுர்காரகனின்று அஷ்டமாதிபதியாகிய குருவாலும் ஷஷ்டாதிபதியாகிய சனியாலும் பார்க்கப்பட்டால் மாதுரு இளமையில் மரணம். ஜாதகன் மருதாயிடம் வளரும்.,Moon is placed in the 4th house and is aspected by the 8th lord Jupiter placed in the 12th house and by the 6th lord Saturn placed in the 2nd house. The mother will die when the native is young. Native will live under another mother (sister of the mother).,Leo,Chandra
Leo-17,"பத்தாமிடத்தில் சனியும், த்ரீதிய கர்மாதிபதியும் விரயாதிபதியும் சுக பாக்கியாதிபதியுடனும் சுக ஸ்தானம் ஏறி நின்றால் தாயுடன் ஆண் விருத்தி ஏகன். சனி திசை சுக்கிர புக்தி தாய்க்கு கண்டம். 3-வயதில் தாய்க்கும் சிசுவுக்கும் அரிட்டம் காட்டும்.","Saturn is placed in the 10th house. In the 4th house of comforts, the 3rd and 10th lords, Venus, the 12th lord Moon, and the 4th and 9th lords, Mars, are all placed and thereby mutually aspect each other, along with the mother; one male sibling will be there who will prosper. Saturn dasa Venus Bhukti mother will have a critical period. When the native is three years old, the mother will face disaster.",Leo,Chandra
Leo-18,பத்தாமிடத்தில் புத சூரியனும் நான்காமிடத்தில் சந்திரன் கேதுவும் நின்றால் கேது திசையில் தாய் மாரகம். தவரில்ர்க்க வயதிருப்பள். அம்மான் இரண்டு விர்த்தி. புதன் திசையில் களத்திர லாபமுண்டாகி கேது திசையில் பிரிவுபடும் என்பர்.,"The Moon is placed in the 4th house, along with Ketu, and is aspected by Mercury and the Sun, which are placed in the 10th house. In the dasa of Ketu, the mother will die. Two uncles will prosper. In the Dasa of Mercury, the wife will come, and in the Dasa of Ketu, there will be separation. Note: One sentence in the Tamil verse highlighted is not clear.",Leo,Chandra
Leo-19,நாலாமிடம் மாதுர்காரகன் நின்று பாக்கிய ஸ்தானத்தில் பாக்கியாதி நின்றால் சுக ஸ்தானமேறிப் பாக்கியாதியால் பார்க்கப் பட்டால் தாயுடன் ஆணிரண்டு பெண்ணிரண்டில் ஒன்று தீர்க்கம். 19 வயது வரையில் தாய் தீர்க்கம்.,"Moon is placed in the 4th house and in the 9th house, the lord of the 4th and 9th houses, Mars, is placed and aspects Moon. Along with the mother, there will be two male and two female siblings. Of which one will be long-lived? Until the age of 19, the native mother will live.",Leo,Chandra
Leo-20,ஐந்தாமிடத்தில் சந்திரன் கேது நின்று பத்தாமிடத்தில் ரோகாதிபதியும் நின்றால் தாயுடன் ஆணிரண்டு பெண்-3. தாய் இளமையில் மரணமாவள்.,"Moon is placed in the 5th house along with Ketu, and in the 10th house, 6th lord Saturn is placed. The mother will have two male and three female co-born. The mother will die when the native is young.",Leo,Chandra
Leo-21,பஞ்சம ஸ்தானத்தில் விரயாதி நின்று லாப ஸ்தானத்தில் லாபாதி ஆக்ஷிப் பெற்று பார்ப்பதால் தாய் 35 வயதில்  நிர்யாணம். தாயுடன் அம்மான்-1.,"The 12th lord, Moon, is placed in the 5th house and in the 11th house of gains, the lord of the 11th house, Mercury, is placed and aspects the Moon. The mother will die when the native is 35 years old. There will be one maternal uncle.",Leo,Chandra
Leo-22,பஞ்சம ஸ்தானத்தில் விரயாதிபதியும் பஞ்சம அஷ்டமாதிபதியாகிய குரு லக்கினத்தில் நின்று மாதுர்காரகனைப் பார்ப்பதாலும் தாய் வர்க்கம் ஐந்து நிலுவை-3. ஜாதகன் மேலான யோகமாவன்.,"The 12th lord Moon is placed in the 5th house and in the Lagna Kendra, where the 5th and 8th lord Jupiter is situated and aspects this Moon. There will be five members in the mother's family, of which three will remain. Native will have a high fortune.",Leo,Chandra
Leo-23,பஞ்சமத்தில் விரயாதிபதியும் சுக ஸ்தானத்தில் ரவி புத சுக்ர அங்காரகன் இவர்கள் நின்று இருப்பதாலும் மாதாவுக்கு இளமையில் கண்டம். தாயுடன் ஆணிரண்டு பெண்-2.,"In the fifth house, the 12th lord is placed, and in the 4th house of comforts, Sun, Mercury, Venus and Mars are placed. The mother will have a critical period when the native is young. Mother will have two male and two female siblings.",Leo,Chandra
Leo-24,பஞ்சம அஷ்டமாதியுடன் விரயாதிபதியும் சேர்ந்து பஞ்சமத்தில் நின்றால் ஜாதகன் வயது 40-ல் தாய் மரணம். ஒருவரும் பாராதிருக்க வேண்டும். தாயுடன் ஆணிரண்டு தீர்க்கம்-1.,"5th and 8th lord Jupiter is conjoined with the 12th lord Moon and is placed in the 5th house; the mother will die when the native is 40 years old. The combination should be unaspected. Co-born of the mother are two males, of which one will be long-lived.",Leo,Chandra
Leo-25,மாதுர் காரகன் தன லாபாதியுடன் ஆறாமிடமேறியும் சேயலரிமந்தன் பஞ்சம ஸ்தானத்தில் நிற்பதால் தாயுடன் சகோதிரமெட்டு. தாய் தீர்க்கம் மற்றவர்கள் நாசம்.,"Karaka for mother is placed in the 6th house along with the 2nd and 11th house lord Mercury, and in the fifth house, Saturn, Mars and Sun are placed. There will be eight siblings for the mother. Mother will be long-lived, and others will perish.",Leo,Chandra
Leo-26,பனிரெண்டாமிடத்தில் சுக பாக்கியாதி தன லாபாதியுடனும்  ஆறாமிடத்தில் மாதுர் காரகனும் நின்றபடியால் தாயுடன் ஆணிரண்டு பெண்-3. தகப்பன் வியாபாரம்.,"Moon is placed in the 6th house and is aspected by the 4th and 9th lord Mars, and 2nd and 11th lord Mercury placed in the 12th house. There will be two male and three female siblings for the mother. Father will be doing trade.",Leo,Chandra
Leo-27,பஞ்சம அஷ்டமாதிபதி தசமத்திலும் மாதுர்காரகன் ஆறாமிடத்தில் ஷஷ்டம சப்தமாதியுடன் நின்று குருவால் பார்க்கப்பட்டால் இருபதில்  தாய் மரணம்.,"5th and 8th lord Jupiter is placed in the 10th house, and in the 6th house, the karaka for mother Moon is with 6th and 7th lord Saturn, and thus receives the aspect of Jupiter. The mother will die when the native is 20 years old.",Leo,Chandra
Leo-28,ஆறாமிடத்தில் சந்திரனும்  எட்டில் சுக்கிரனும் ஆறாமாதி பாக்கியத்தில் நின்றும் சந்திரனைப் பார்த்திருப்பதாலும் கர்மாதி அஷ்டமத்தில் இருப்பதாலும் தாய் சிசு இருவர்க்கு கண்டம்.,"The Moon is placed in the 6th house, and the 3rd and 10th lord, Venus, is exalted in the 8th house. The Moon is aspected by the 6th and 7th lord, Saturn, placed in the 9th house. The mother and child will face a critical period.",Leo,Chandra
Leo-29,ஆறாமிடத்தில் சந்திரன் ராகுவும் பனிரெண்டில் சேயும் பத்தாமிடத்தில்  சனியும் நின்று பார்த்திருப்பதால் தாயுடன் ஆணிரண்டு பெண் இரண்டு சுகமில்லை தாய்க்கு சந்திர திசையில் கண்டம்.,"The Moon is placed in the 6th house, along with Rahu, aspected by Mars in the 12th house. This Mars is, in turn, aspected by Saturn in the 10th house. Along with the mother, there will be two male and two female siblings who will not be in comfort. Mother will have a critical period during Moon dasa.",Leo,Chandra
Leo-30,அஷ்டமாதி பாக்கியத்திலும் விரயாதி ஆறாமிடம் நின்றும் விரய ஸ்தானத்தில் குடும்ப லாபாதிபதியும் த்ரீதீய கர்மாதிபதியும் நின்று மிருப்பதால் தாய் வர்க்கம் பெண் இரண்டு ஆண்-1. தாய் தீர்க்கம்.,"The Moon is placed in the 6th house and aspected by the 2nd and 11th lord, Mercury, placed in the 12th house. The 3rd and 10th lord, Venus, is also placed in the 12th house, and the 8th lord, Jupiter, is placed in the 9th house. Therefore, the mother's family will have two female and one male member. Mother will be long-lived.",Leo,Chandra
Leo-31,"லக்கினாதிபதியுடன் குடும்ப லாபாதிபதியும் லக்கின கேந்திரம் பெற்றும் சப்தமத்தில் சந்திரன் நின்றுமிருப்பதால் தாய் தீர்க்கம். தாயுள் ஆனிரண்டு, பெண்-2","Moon is placed in the 7th house and is aspected by the 2nd and 11th lord Mercury, placed in Lagna Kendra, and by Lagna lord Sun, who is also placed in Lagna. The mother will be long-lived. Mother will have two female and two male siblings.",Leo,Chandra
Leo-32,"அஷ்டபாதி பதினாலும் சப்தம மத்திய விரயாதிபதியும் கேதுவும் இருப்பதால் பால்யத்தில் இருவர்க்கும் கண்டம். கேதுவில் தாய் மரணம். (இந்த வரிகளில் தவறு இருப்பதாகத் தெரிகிறது) There seems to be some error in the Tamil verse. Translated with the chart available in the Nadi. The Moon is placed in the 7th house, along with Saturn and Ketu, and is aspected by the 5th and 8th lord, Jupiter, which is in the 3rd house. When the native is very young, both the mother and child will experience a critical period. In the dasa of Ketu, the mother will die.",,Leo,Chandra
Leo-33,அஷ்டமாதி சப்தம கேந்திரமாகியும் விரயாதியுடன் சேர்ந்தும் அஷ்டமத்தில் சனியும் நிற்பால் தாய் வர்க்கம் தாயுடன்-6. விருத்தி-1,"8th lord Jupiter is in the 7th house along with Moon, and in the 8th house, Saturn is placed, along with the mother. There will be six members, of whom one will prosper.",Leo,Chandra
Leo-34,"தனலாபாதியுடன் கர்மாதிபதியும் லக்கினாதிபதியும் சேர்ந்து கர்ம ஸ்தானம் ஏறி விரயாதியைப் பார்த்தால் தாய் தீர்க்கம். தாயுடன் ஆண் -2, பெண் -2. விருத்தி.","If the 2nd and 11th lord Mercury conjoins the Lagna lord Sun and the 3rd and 10th lord Venus and is placed in the 10th house (this combination should be placed in Lagna to aspect the 12th lord Moon placed in the 7th house-but in the verse, it is stated that this combination of planets is in the 10th house and aspects the 12th lord which is not possible), mother will be long lived. Along with the mother, two males and two females will prosper.",Leo,Chandra
Leo-35,"அஷ்டமாதி லக்கினத்திலும் சுகபாக்கியாதி சப்தம கேந்திரத்திலும் விரயாதியுடன் சம்மந்தப் பட்டிருப்பதால் தாயுடன் ஆண்-3, பெண்-2, குரு திசை சந்திர புத்தி தாய்க்கும் சேய்க்கும் கண்டம்.","The 8th lord is in Lagna and aspects the karaka for mother Moon, which is placed in the 7th house along with 4th and 9th lord Mars. Along with the mother, there will be two males and two females. Jupiter dasa, Moon Bhukti, mother and child will have a critical period.",Leo,Chandra
Leo-36,எட்டாமிடத்தில் மாதுருக்காரகன் பூர்வமாகி குரு ராகுவுடன் கூடி லாபாதி தானமேறிய ரோக சப்தமாதிபதியால் நோக்கப்பட்டால் தாய் வர்க்கத்தில் சூனியம் பிரமை குடும்ப பேதமுண்டாம். ஜாதகன் பத்தொன்பது வயதில் மரணமாவனென்பர்.,"The Moon is placed in the 8th house, along with Rahu and Jupiter, and is aspected by the 6th and 7th lord, Saturn, placed in the 11th house. The mother's family will be seized with the ignorance of having come under witchcraft. There will be a difference of opinion in the family. Native will die at the age of 19.",Leo,Chandra
Leo-37,எட்டாமிடத்தில் மாதுருக்காரகன் அமரமாகி ஸ்வக்ஷேத்திர பஞ்சம அஷ்டமாதிபதியுடன் கூடி மாதுரு ஸ்தானத்தில் ராகுயிருந்தால் தாய் வர்க்கம் ஆண் மூன்று பெண்ணிரண்டு தாய் தீர்க்கம் அம்மான்கள் இரண்டு. மூன்று தாரமுடையவர்களாய் மேன்மையா யிருப்பார்களென்பர்.,"Karaka for the mother, Moon is placed in the 8th house, along with the 5th and 8th lord,  Jupiter and Rahu is placed in the 4th house of the mother; the mother's family will have three male and two female co-born children. Mother will be long-lived. Two maternal uncles will have three wives each and will have a high status.",Leo,Chandra
Leo-38,எட்டாமிடத்தில் மாதுருக்காரகன் அமரமாகி ஏகனாய் தனித்து குடும்பமேறிய ஜென்ம தன லாபாதிபதிகளால் பார்க்கப் பட்டிருந்தால் தாயுடன் ஆணொன்று பெண்ணைந்து ஆண் விர்த்தியில்லை இருபத்து நான்கு வரையில் தாய் தீர்க்கமென்பர்.,"Moon is placed in the 8th house and is aspected by the 2nd and 11th lord Mercury and by the Lagna lord Sun, both placed in the 2nd house; there will be one male and five female siblings. The male sibling will have no progress. Mother will pass away when the native is 24 years old.",Leo,Chandra
Leo-39,எட்டாமிடத்தில் மாதுருக்காரகன் பூர்வமாகி ஏகனாய் நின்று வாக்கு ஸ்தானமேறிய சுக ரோக சப்தம பாக்கியாதிபதிகளால் பார்க்கப்பட்டால் தாய் வர்க்கம் ஆண் நான்கில் விர்த்தி யிரண்டு தாய் ஏழு வயதில் மரணமாவளென்பர்.,"The Moon is placed in the 8th house and is aspected by the 6th and 7th lords, Saturn, and the 4th and 9th lords, Mars, both of which are placed in the 2nd house. Out of the four male siblings of the mother, two will prosper. The mother will die when the native is 7 years old.",Leo,Chandra
Leo-40,எட்டாமிடத்தில் மாதுருக்காரகன் அமரமாகி ஏகனாயிருந்து ஒருவரும் பாராமல் மாதுரு ஸ்தானத்தில் ராகுயிருந்தால் ஜாதகன் பிதுர் மாதுருகளுக்குக் கர்மம் செய்ய மாட்டானென்பர்.,"Moon is placed in the 8th house, and in the 4th house of the mother, Rahu is placed. The native will not do the karma for the parents, i.e. he will die before the death of his parents.",Leo,Chandra
Leo-41,ஒன்பதாமிடத்தில் மாதுருக்காரகன் அமரமாகி கேதுவுடன் கூடி திருதியமேறிய உச்ச சனியால் பார்க்கப்பட்டால் தாய் நாற்பது வரையில் தீர்க்கம். விரையாதிபன் திசையில் சமபலனுண்டென்பர்.,"Moon is placed in the 9th house along with Ketu and is aspected by the 6th and 7th lord, Saturn, placed in the 3rd house. The mother will live until the age of 40 for the native. In the dasa of the 12th lord, there will be equal results.",Leo,Chandra
